{
  "$id": "https://raw.githubusercontent.com/slimissa/exchange-calendar/main/schema.json",
  "$schema": "http://json-schema.org/draft-07/schema#",
  "additionalProperties": false,
  "description": "Schema for a single exchange calendar file in the QuantOS exchange-calendar registry.",
  "properties": {
    "ad_hoc_closures": {
      "description": "Unplanned closures that cannot be generated by recurrence rules.",
      "items": {
        "additionalProperties": false,
        "allOf": [
          {
            "if": {
              "properties": {
                "status": {
                  "const": "early_close"
                }
              },
              "required": [
                "status"
              ]
            },
            "then": {
              "required": [
                "early_close_time"
              ]
            }
          }
        ],
        "properties": {
          "date": {
            "pattern": "^[0-9]{4}-[0-9]{2}-[0-9]{2}$",
            "type": "string"
          },
          "early_close_time": {
            "pattern": "^([01][0-9]|2[0-3]):[0-5][0-9]$",
            "type": "string"
          },
          "name": {
            "minLength": 3,
            "type": "string"
          },
          "source_url": {
            "format": "uri",
            "type": "string"
          },
          "status": {
            "enum": [
              "closed",
              "early_close"
            ],
            "type": "string"
          }
        },
        "required": [
          "date",
          "name",
          "status",
          "source_url"
        ],
        "type": "object"
      },
      "type": "array"
    },
    "code": {
      "description": "Exchange identifier. Must equal the ISO 10383 MIC.",
      "pattern": "^[A-Z0-9]{4}$",
      "type": "string"
    },
    "country": {
      "minLength": 1,
      "type": "string"
    },
    "country_code": {
      "pattern": "^[A-Z]{2}$",
      "type": "string"
    },
    "extended_hours": {
      "additionalProperties": false,
      "properties": {
        "after_hours": {
          "additionalProperties": false,
          "properties": {
            "close": {
              "pattern": "^([01][0-9]|2[0-3]):[0-5][0-9]$",
              "type": "string"
            },
            "open": {
              "pattern": "^([01][0-9]|2[0-3]):[0-5][0-9]$",
              "type": "string"
            }
          },
          "required": [
            "open",
            "close"
          ],
          "type": "object"
        },
        "pre_market": {
          "additionalProperties": false,
          "properties": {
            "close": {
              "pattern": "^([01][0-9]|2[0-3]):[0-5][0-9]$",
              "type": "string"
            },
            "open": {
              "pattern": "^([01][0-9]|2[0-3]):[0-5][0-9]$",
              "type": "string"
            }
          },
          "required": [
            "open",
            "close"
          ],
          "type": "object"
        }
      },
      "type": "object"
    },
    "fetcher_status": {
      "description": "State of this exchange's automated fetcher in tools/update_from_exchange.py. implemented: a fetcher is registered and CI verifies it against the live source. ci_unreachable: a fetcher is registered and works, but the source cannot be reached from GitHub Actions runners, so CI does not verify it. blocked: a fetcher is registered but the source currently refuses it (for example HTTP 403) from every network tried. none: no fetcher is registered; the exchange is maintained by hand. This field is the source of truth for fetcher status.",
      "enum": [
        "implemented",
        "ci_unreachable",
        "blocked",
        "none"
      ],
      "type": "string"
    },
    "generation_range": {
      "description": "Inclusive date range [start, end] within which explicit dates are verified.",
      "items": {
        "pattern": "^[0-9]{4}-[0-9]{2}-[0-9]{2}$",
        "type": "string"
      },
      "maxItems": 2,
      "minItems": 2,
      "type": "array"
    },
    "holidays": {
      "additionalProperties": false,
      "properties": {
        "explicit": {
          "description": "Explicitly dated holidays and special sessions. This is the primary data source.",
          "items": {
            "additionalProperties": false,
            "allOf": [
              {
                "if": {
                  "properties": {
                    "status": {
                      "const": "early_close"
                    }
                  },
                  "required": [
                    "status"
                  ]
                },
                "then": {
                  "required": [
                    "early_close_time"
                  ]
                }
              },
              {
                "if": {
                  "properties": {
                    "status": {
                      "const": "delayed_open"
                    }
                  },
                  "required": [
                    "status"
                  ]
                },
                "then": {
                  "required": [
                    "delayed_open_time"
                  ]
                }
              }
            ],
            "properties": {
              "date": {
                "pattern": "^[0-9]{4}-[0-9]{2}-[0-9]{2}$",
                "type": "string"
              },
              "delayed_open_time": {
                "description": "Required when status is delayed_open.",
                "pattern": "^([01][0-9]|2[0-3]):[0-5][0-9]$",
                "type": "string"
              },
              "early_close_time": {
                "description": "Required when status is early_close.",
                "pattern": "^([01][0-9]|2[0-3]):[0-5][0-9]$",
                "type": "string"
              },
              "name": {
                "minLength": 3,
                "type": "string"
              },
              "predicted": {
                "default": false,
                "description": "True when this date is a calculated/estimated moon-sighting-dependent date (e.g. Islamic-calendar holidays) that has not yet been confirmed by an official announcement, and may still shift by a day. For backward compatibility, many existing entries instead encode this as a '(predicted)' suffix on `name` rather than this field -- both forms are currently accepted, but new entries should prefer this structured field since it's queryable without string-parsing `name`.",
                "type": "boolean"
              },
              "source_url": {
                "format": "uri",
                "type": "string"
              },
              "status": {
                "enum": [
                  "closed",
                  "early_close",
                  "delayed_open",
                  "special_session"
                ],
                "type": "string"
              },
              "weekend_exception": {
                "description": "Set true only when this date legitimately falls on the exchange's own weekend_days AND is still independently sourced as a distinct, exchange-gazetted event (e.g. a specific Muhurat trading session on Diwali). This is a deliberate, narrow override of the weekend-date validation check, not a general escape hatch -- do not set it just to silence a validation failure.",
                "type": "boolean"
              }
            },
            "required": [
              "date",
              "name",
              "status"
            ],
            "type": "object"
          },
          "type": "array"
        },
        "recurrence_rules": {
          "description": "Mechanically generatable holidays. Explicit dates take precedence.",
          "items": {
            "additionalProperties": false,
            "allOf": [
              {
                "if": {
                  "properties": {
                    "rule": {
                      "const": "nth_weekday"
                    }
                  },
                  "required": [
                    "rule"
                  ]
                },
                "then": {
                  "required": [
                    "month",
                    "weekday",
                    "n"
                  ]
                }
              },
              {
                "if": {
                  "properties": {
                    "rule": {
                      "const": "last_weekday"
                    }
                  },
                  "required": [
                    "rule"
                  ]
                },
                "then": {
                  "required": [
                    "month",
                    "weekday"
                  ]
                }
              },
              {
                "if": {
                  "properties": {
                    "rule": {
                      "const": "easter_offset"
                    }
                  },
                  "required": [
                    "rule"
                  ]
                },
                "then": {
                  "required": [
                    "offset_days"
                  ]
                }
              },
              {
                "if": {
                  "properties": {
                    "rule": {
                      "const": "fixed_date"
                    }
                  },
                  "required": [
                    "rule"
                  ]
                },
                "then": {
                  "required": [
                    "month",
                    "day"
                  ]
                }
              },
              {
                "if": {
                  "properties": {
                    "rule": {
                      "const": "fixed_with_weekend_adjustment"
                    }
                  },
                  "required": [
                    "rule"
                  ]
                },
                "then": {
                  "required": [
                    "month",
                    "day"
                  ]
                }
              },
              {
                "if": {
                  "properties": {
                    "status": {
                      "const": "early_close"
                    }
                  },
                  "required": [
                    "status"
                  ]
                },
                "then": {
                  "required": [
                    "early_close_time"
                  ]
                }
              }
            ],
            "properties": {
              "day": {
                "maximum": 31,
                "minimum": 1,
                "type": "integer"
              },
              "early_close_time": {
                "pattern": "^([01][0-9]|2[0-3]):[0-5][0-9]$",
                "type": "string"
              },
              "effective_from": {
                "description": "First date on which this rule generates a holiday (inclusive). Earlier dates are not generated and must be listed in holidays.explicit, for rules that were not in force historically or whose earlier years are backfilled explicitly.",
                "pattern": "^[0-9]{4}-[0-9]{2}-[0-9]{2}$",
                "type": "string"
              },
              "month": {
                "maximum": 12,
                "minimum": 1,
                "type": "integer"
              },
              "n": {
                "description": "For nth_weekday rule: 1=first, 2=second, ..., 5=last",
                "maximum": 5,
                "minimum": 1,
                "type": "integer"
              },
              "name": {
                "minLength": 3,
                "type": "string"
              },
              "offset_days": {
                "description": "For easter_offset rule: days relative to Easter Sunday (negative = before)",
                "type": "integer"
              },
              "rule": {
                "enum": [
                  "fixed_date",
                  "fixed_with_weekend_adjustment",
            "fixed_with_thursday_observance",
                  "nth_weekday",
                  "last_weekday",
                  "easter_offset"
                ],
                "type": "string"
              },
              "source_url": {
                "format": "uri",
                "type": "string"
              },
              "status": {
                "enum": [
                  "closed",
                  "early_close"
                ],
                "type": "string"
              },
              "weekday": {
                "enum": [
                  "monday",
                  "tuesday",
                  "wednesday",
                  "thursday",
                  "friday",
                  "saturday",
                  "sunday"
                ],
                "type": "string"
              }
            },
            "required": [
              "rule",
              "name",
              "status"
            ],
            "type": "object"
          },
          "type": "array"
        }
      },
      "required": [
        "explicit"
      ],
      "type": "object"
    },
    "mic": {
      "description": "ISO 10383 Market Identifier Code. Must equal code.",
      "pattern": "^[A-Z0-9]{4}$",
      "type": "string"
    },
    "name": {
      "description": "Full exchange name.",
      "minLength": 3,
      "type": "string"
    },
    "regular_hours": {
      "additionalProperties": false,
      "properties": {
        "close": {
          "pattern": "^([01][0-9]|2[0-3]):[0-5][0-9]$",
          "type": "string"
        },
        "open": {
          "pattern": "^([01][0-9]|2[0-3]):[0-5][0-9]$",
          "type": "string"
        }
      },
      "required": [
        "open",
        "close"
      ],
      "type": "object"
    },
    "sessions": {
      "description": "Typed trading sessions. Interval types carry open/close; point types carry at.",
      "type": "array",
      "minItems": 1,
      "items": {
        "type": "object",
        "additionalProperties": false,
        "required": [
          "type"
        ],
        "properties": {
          "type": {
            "enum": [
              "regular",
              "pre_market",
              "post_market",
              "lunch_break",
              "auction",
              "halt"
            ],
            "type": "string"
          },
          "open": {
            "description": "Start time. Required for interval types.",
            "pattern": "^([01][0-9]|2[0-3]):[0-5][0-9]$",
            "type": "string"
          },
          "close": {
            "description": "End time. Required for interval types.",
            "pattern": "^([01][0-9]|2[0-3]):[0-5][0-9]$",
            "type": "string"
          },
          "at": {
            "description": "Point-in-time moment. Required for point types.",
            "pattern": "^([01][0-9]|2[0-3]):[0-5][0-9]$",
            "type": "string"
          }
        },
        "allOf": [
          {
            "if": {
              "properties": {
                "type": {
                  "enum": [
                    "regular",
                    "pre_market",
                    "post_market",
                    "lunch_break"
                  ]
                }
              },
              "required": [
                "type"
              ]
            },
            "then": {
              "required": [
                "open",
                "close"
              ]
            }
          },
          {
            "if": {
              "properties": {
                "type": {
                  "enum": [
                    "auction",
                    "halt"
                  ]
                }
              },
              "required": [
                "type"
              ]
            },
            "then": {
              "required": [
                "at"
              ]
            }
          }
        ]
      }
    },
    "timezone": {
      "description": "IANA timezone identifier.",
      "pattern": "^[A-Za-z0-9_+\\-]+/[A-Za-z0-9_+\\-]+(?:/[A-Za-z0-9_+\\-]+)?$",
      "type": "string"
    },
    "weekend_days": {
      "description": "The two weekday numbers (0=Monday..6=Sunday) that are non-trading weekend days for this exchange.",
      "items": {
        "maximum": 6,
        "minimum": 0,
        "type": "integer"
      },
      "maxItems": 2,
      "minItems": 2,
      "type": "array"
    },
    "confidence": {
      "description": "Per-year confidence in the exchange's calendar data. Derived, not authored.",
      "type": "object",
      "minProperties": 1,
      "propertyNames": {
        "pattern": "^\\d{4}$"
      },
      "additionalProperties": {
        "type": "object",
        "required": [
          "source",
          "level"
        ],
        "additionalProperties": false,
        "properties": {
          "source": {
            "enum": [
              "fetcher",
              "manual",
              "predicted"
            ]
          },
          "last_verified": {
            "type": [
              "string",
              "null"
            ],
            "pattern": "^\\d{4}-\\d{2}-\\d{2}$"
          },
          "level": {
            "enum": [
              "high",
              "medium",
              "low"
            ]
          },
          "note": {
            "type": "string"
          }
        }
      }
    }
  },
  "required": [
    "code",
    "name",
    "mic",
    "timezone",
    "weekend_days",
    "regular_hours",
    "holidays",
    "generation_range",
    "country",
    "country_code",
    "sessions",
    "fetcher_status"
  ],
  "title": "Exchange Calendar Entry",
  "type": "object",
  "version": "2.1.1"
}
