{
  "ad_hoc_closures": [],
  "code": "XBRU",
  "confidence": {
    "2025": {
      "last_verified": null,
      "level": "medium",
      "source": "manual"
    },
    "2026": {
      "last_verified": null,
      "level": "medium",
      "source": "manual"
    },
    "2027": {
      "last_verified": null,
      "level": "medium",
      "note": "predicted",
      "source": "manual"
    },
    "2028": {
      "last_verified": null,
      "level": "medium",
      "note": "predicted",
      "source": "manual"
    },
    "2029": {
      "last_verified": null,
      "level": "medium",
      "note": "predicted",
      "source": "manual"
    }
  },
  "country": "Belgium",
  "country_code": "BE",
  "fetcher_status": "implemented",
  "generation_range": [
    "2025-01-01",
    "2029-12-31"
  ],
  "holidays": {
    "explicit": [
      {
        "date": "2025-01-01",
        "name": "New Year's Day",
        "source_url": "https://www.euronext.com/en/trading-calendar",
        "status": "closed"
      },
      {
        "date": "2025-04-18",
        "name": "Good Friday",
        "source_url": "https://live.euronext.com/en/resources/trading-hours-holidays",
        "status": "closed"
      },
      {
        "date": "2025-04-21",
        "name": "Easter Monday",
        "source_url": "https://www.euronext.com/en/trading-calendar",
        "status": "closed"
      },
      {
        "date": "2025-05-01",
        "name": "Labour Day",
        "source_url": "https://www.euronext.com/en/trading-calendar",
        "status": "closed"
      },
      {
        "date": "2025-12-25",
        "name": "Christmas Day",
        "source_url": "https://www.euronext.com/en/trading-calendar",
        "status": "closed"
      },
      {
        "date": "2025-12-26",
        "name": "Boxing Day",
        "source_url": "https://www.euronext.com/en/trading-calendar",
        "status": "closed"
      },
      {
        "date": "2026-01-01",
        "name": "New Year's Day",
        "source_url": "https://www.euronext.com/en/trading-calendar",
        "status": "closed"
      },
      {
        "date": "2026-04-03",
        "name": "Good Friday",
        "source_url": "https://live.euronext.com/en/resources/trading-hours-holidays",
        "status": "closed"
      },
      {
        "date": "2026-04-06",
        "name": "Easter Monday",
        "source_url": "https://www.euronext.com/en/trading-calendar",
        "status": "closed"
      },
      {
        "date": "2026-05-01",
        "name": "Labour Day",
        "source_url": "https://www.euronext.com/en/trading-calendar",
        "status": "closed"
      },
      {
        "date": "2026-12-25",
        "name": "Christmas Day",
        "source_url": "https://www.euronext.com/en/trading-calendar",
        "status": "closed"
      },
      {
        "date": "2027-01-01",
        "name": "New Year's Day",
        "source_url": "https://www.euronext.com/en/trading-calendar",
        "status": "closed"
      },
      {
        "date": "2027-03-26",
        "name": "Good Friday",
        "source_url": "https://www.euronext.com/en/trading-calendar",
        "status": "closed"
      },
      {
        "date": "2027-03-29",
        "name": "Easter Monday",
        "source_url": "https://www.euronext.com/en/trading-calendar",
        "status": "closed"
      },
      {
        "date": "2028-04-14",
        "name": "Good Friday",
        "source_url": "https://www.euronext.com/en/trading-calendar",
        "status": "closed"
      },
      {
        "date": "2028-04-17",
        "name": "Easter Monday",
        "source_url": "https://www.euronext.com/en/trading-calendar",
        "status": "closed"
      },
      {
        "date": "2028-05-01",
        "name": "Labour Day",
        "source_url": "https://www.euronext.com/en/trading-calendar",
        "status": "closed"
      },
      {
        "date": "2028-12-25",
        "name": "Christmas Day",
        "source_url": "https://www.euronext.com/en/trading-calendar",
        "status": "closed"
      },
      {
        "date": "2028-12-26",
        "name": "Boxing Day",
        "source_url": "https://www.euronext.com/en/trading-calendar",
        "status": "closed"
      },
      {
        "date": "2029-01-01",
        "name": "New Year's Day",
        "source_url": "https://www.euronext.com/en/trading-calendar",
        "status": "closed"
      },
      {
        "date": "2029-03-30",
        "name": "Good Friday",
        "source_url": "https://www.euronext.com/en/trading-calendar",
        "status": "closed"
      },
      {
        "date": "2029-04-02",
        "name": "Easter Monday",
        "source_url": "https://www.euronext.com/en/trading-calendar",
        "status": "closed"
      },
      {
        "date": "2029-05-01",
        "name": "Labour Day",
        "source_url": "https://www.euronext.com/en/trading-calendar",
        "status": "closed"
      },
      {
        "date": "2029-12-25",
        "name": "Christmas Day",
        "source_url": "https://www.euronext.com/en/trading-calendar",
        "status": "closed"
      },
      {
        "date": "2029-12-26",
        "name": "Boxing Day",
        "source_url": "https://www.euronext.com/en/trading-calendar",
        "status": "closed"
      }
    ],
    "recurrence_rules": []
  },
  "mic": "XBRU",
  "name": "Euronext Brussels",
  "regular_hours": {
    "close": "17:30",
    "open": "09:00"
  },
  "sessions": [
    {
      "close": "17:30",
      "open": "09:00",
      "type": "regular"
    }
  ],
  "timezone": "Europe/Brussels",
  "weekend_days": [
    5,
    6
  ]
}
