{
  "ad_hoc_closures": [],
  "code": "XSAU",
  "confidence": {
    "2025": {
      "last_verified": null,
      "level": "medium",
      "source": "manual"
    },
    "2026": {
      "last_verified": null,
      "level": "medium",
      "source": "manual"
    },
    "2027": {
      "last_verified": null,
      "level": "medium",
      "note": "predicted",
      "source": "manual"
    },
    "2028": {
      "last_verified": null,
      "level": "medium",
      "note": "predicted",
      "source": "manual"
    },
    "2029": {
      "last_verified": null,
      "level": "medium",
      "note": "predicted",
      "source": "manual"
    }
  },
  "country": "Saudi Arabia",
  "country_code": "SA",
  "extended_hours": {
    "after_hours": {
      "close": "15:20",
      "open": "15:00"
    },
    "pre_market": {
      "close": "10:00",
      "open": "09:30"
    }
  },
  "fetcher_status": "blocked",
  "generation_range": [
    "2025-01-01",
    "2029-09-23"
  ],
  "holidays": {
    "explicit": [
      {
        "date": "2025-02-23",
        "name": "Saudi Founding Day (observed)",
        "source_url": "https://www.saudiexchange.sa/wps/portal/tadawul/markets/equities/market-information/trading-calendar",
        "status": "closed"
      },
      {
        "date": "2025-03-30",
        "name": "Eid al-Fitr",
        "predicted": false,
        "source_url": "https://www.ummulqura.org.sa/",
        "status": "closed"
      },
      {
        "date": "2025-03-31",
        "name": "Eid al-Fitr Holiday",
        "predicted": false,
        "source_url": "https://www.ummulqura.org.sa/",
        "status": "closed"
      },
      {
        "date": "2025-04-01",
        "name": "Eid al-Fitr Holiday",
        "predicted": false,
        "source_url": "https://www.ummulqura.org.sa/",
        "status": "closed"
      },
      {
        "date": "2025-09-23",
        "name": "Saudi National Day",
        "source_url": "https://www.saudiexchange.sa/wps/portal/tadawul/markets/equities/market-information/trading-calendar",
        "status": "closed"
      },
      {
        "date": "2026-02-22",
        "name": "Saudi Founding Day",
        "source_url": "https://www.saudiexchange.sa/wps/portal/tadawul/markets/equities/market-information/trading-calendar",
        "status": "closed"
      },
      {
        "date": "2026-09-23",
        "name": "Saudi National Day",
        "source_url": "https://www.saudiexchange.sa/wps/portal/tadawul/markets/equities/market-information/trading-calendar",
        "status": "closed"
      },
      {
        "date": "2027-02-22",
        "name": "Saudi Founding Day",
        "source_url": "https://www.saudiexchange.sa/wps/portal/tadawul/markets/equities/market-information/trading-calendar",
        "status": "closed"
      },
      {
        "date": "2027-03-09",
        "name": "Eid al-Fitr (predicted)",
        "predicted": true,
        "source_url": "https://www.ummulqura.org.sa/",
        "status": "closed"
      },
      {
        "date": "2027-03-10",
        "name": "Eid al-Fitr Holiday (predicted)",
        "predicted": true,
        "source_url": "https://www.ummulqura.org.sa/",
        "status": "closed"
      },
      {
        "date": "2027-03-11",
        "name": "Eid al-Fitr Holiday (predicted)",
        "predicted": true,
        "source_url": "https://www.ummulqura.org.sa/",
        "status": "closed"
      },
      {
        "date": "2027-05-16",
        "name": "Eid al-Adha (predicted)",
        "predicted": true,
        "source_url": "https://www.ummulqura.org.sa/",
        "status": "closed"
      },
      {
        "date": "2027-05-17",
        "name": "Eid al-Adha Holiday (predicted)",
        "predicted": true,
        "source_url": "https://www.ummulqura.org.sa/",
        "status": "closed"
      },
      {
        "date": "2027-05-18",
        "name": "Eid al-Adha Holiday (predicted)",
        "predicted": true,
        "source_url": "https://www.ummulqura.org.sa/",
        "status": "closed"
      },
      {
        "date": "2027-06-06",
        "name": "Islamic New Year (predicted)",
        "predicted": true,
        "source_url": "https://www.ummulqura.org.sa/",
        "status": "closed"
      },
      {
        "date": "2027-09-23",
        "name": "Saudi National Day",
        "source_url": "https://www.saudiexchange.sa/wps/portal/tadawul/markets/equities/market-information/trading-calendar",
        "status": "closed"
      },
      {
        "date": "2028-02-22",
        "name": "Saudi Founding Day",
        "source_url": "https://www.saudiexchange.sa/wps/portal/tadawul/markets/equities/market-information/trading-calendar",
        "status": "closed"
      },
      {
        "date": "2028-02-27",
        "name": "Eid al-Fitr Holiday (predicted)",
        "predicted": true,
        "source_url": "https://www.ummulqura.org.sa/",
        "status": "closed"
      },
      {
        "date": "2028-02-28",
        "name": "Eid al-Fitr Holiday (predicted)",
        "predicted": true,
        "source_url": "https://www.ummulqura.org.sa/",
        "status": "closed"
      },
      {
        "date": "2028-05-04",
        "name": "Eid al-Adha (predicted)",
        "predicted": true,
        "source_url": "https://www.ummulqura.org.sa/",
        "status": "closed"
      },
      {
        "date": "2028-09-24",
        "name": "Saudi National Day (observed)",
        "source_url": "https://www.saudiexchange.sa/wps/portal/tadawul/markets/equities/market-information/trading-calendar",
        "status": "closed"
      },
      {
        "date": "2029-02-14",
        "name": "Eid al-Fitr (predicted)",
        "predicted": true,
        "source_url": "https://www.ummulqura.org.sa/",
        "status": "closed"
      },
      {
        "date": "2029-02-15",
        "name": "Eid al-Fitr Holiday (predicted)",
        "predicted": true,
        "source_url": "https://www.ummulqura.org.sa/",
        "status": "closed"
      },
      {
        "date": "2029-02-22",
        "name": "Saudi Founding Day",
        "source_url": "https://www.saudiexchange.sa/wps/portal/tadawul/markets/equities/market-information/trading-calendar",
        "status": "closed"
      },
      {
        "date": "2029-04-24",
        "name": "Eid al-Adha (predicted)",
        "predicted": true,
        "source_url": "https://www.ummulqura.org.sa/",
        "status": "closed"
      },
      {
        "date": "2029-04-25",
        "name": "Eid al-Adha Holiday (predicted)",
        "predicted": true,
        "source_url": "https://www.ummulqura.org.sa/",
        "status": "closed"
      },
      {
        "date": "2029-04-26",
        "name": "Eid al-Adha Holiday (predicted)",
        "predicted": true,
        "source_url": "https://www.ummulqura.org.sa/",
        "status": "closed"
      },
      {
        "date": "2029-05-14",
        "name": "Islamic New Year (predicted)",
        "predicted": true,
        "source_url": "https://www.ummulqura.org.sa/",
        "status": "closed"
      },
      {
        "date": "2029-09-23",
        "name": "Saudi National Day",
        "source_url": "https://www.saudiexchange.sa/wps/portal/tadawul/markets/equities/market-information/trading-calendar",
        "status": "closed"
      }
    ],
    "recurrence_rules": [
      {
        "day": 22,
        "month": 2,
        "name": "Saudi Founding Day",
        "rule": "fixed_date",
        "status": "closed"
      },
      {
        "day": 23,
        "month": 9,
        "name": "Saudi National Day",
        "rule": "fixed_date",
        "status": "closed"
      }
    ]
  },
  "mic": "XSAU",
  "name": "Saudi Stock Exchange (Tadawul)",
  "regular_hours": {
    "close": "15:00",
    "open": "10:00"
  },
  "sessions": [
    {
      "close": "10:00",
      "open": "09:30",
      "type": "pre_market"
    },
    {
      "close": "15:00",
      "open": "10:00",
      "type": "regular"
    },
    {
      "close": "15:20",
      "open": "15:00",
      "type": "post_market"
    }
  ],
  "timezone": "Asia/Riyadh",
  "weekend_days": [
    4,
    5
  ]
}
