{
  "ad_hoc_closures": [],
  "code": "XMUS",
  "confidence": {
    "2025": {
      "last_verified": null,
      "level": "medium",
      "source": "manual"
    },
    "2026": {
      "last_verified": null,
      "level": "medium",
      "source": "manual"
    },
    "2027": {
      "last_verified": null,
      "level": "medium",
      "note": "predicted",
      "source": "manual"
    },
    "2028": {
      "last_verified": null,
      "level": "medium",
      "note": "predicted",
      "source": "manual"
    },
    "2029": {
      "last_verified": null,
      "level": "medium",
      "note": "predicted",
      "source": "manual"
    }
  },
  "country": "Oman",
  "country_code": "OM",
  "fetcher_status": "none",
  "generation_range": [
    "2025-01-01",
    "2029-12-31"
  ],
  "holidays": {
    "explicit": [
      {
        "date": "2025-01-01",
        "name": "New Year's Day",
        "source_url": "https://www.msx.om/trading-calendar",
        "status": "closed"
      },
      {
        "date": "2025-03-31",
        "name": "Eid al-Fitr",
        "predicted": false,
        "source_url": "https://mera.gov.om/",
        "status": "closed"
      },
      {
        "date": "2025-04-01",
        "name": "Eid al-Fitr Holiday",
        "predicted": false,
        "source_url": "https://mera.gov.om/",
        "status": "closed"
      },
      {
        "date": "2025-04-02",
        "name": "Eid al-Fitr Holiday",
        "predicted": false,
        "source_url": "https://mera.gov.om/",
        "status": "closed"
      },
      {
        "date": "2025-04-03",
        "name": "Eid al-Fitr Holiday",
        "predicted": false,
        "source_url": "https://mera.gov.om/",
        "status": "closed"
      },
      {
        "date": "2025-06-08",
        "name": "Eid al-Adha Holiday",
        "predicted": false,
        "source_url": "https://www.msx.om/trading-calendar",
        "status": "closed"
      },
      {
        "date": "2025-06-09",
        "name": "Eid al-Adha Holiday",
        "predicted": false,
        "source_url": "https://www.msx.om/trading-calendar",
        "status": "closed"
      },
      {
        "date": "2025-06-26",
        "name": "Islamic New Year",
        "predicted": false,
        "source_url": "https://www.msx.om/trading-calendar",
        "status": "closed"
      },
      {
        "date": "2025-07-23",
        "name": "Renaissance Day",
        "source_url": "https://www.msx.om/trading-calendar",
        "status": "closed"
      },
      {
        "date": "2025-09-07",
        "name": "Prophet's Birthday",
        "predicted": false,
        "source_url": "https://www.msx.om/trading-calendar",
        "status": "closed"
      },
      {
        "date": "2025-11-18",
        "name": "National Day",
        "source_url": "https://www.msx.om/trading-calendar",
        "status": "closed"
      },
      {
        "date": "2026-01-01",
        "name": "New Year's Day",
        "source_url": "https://www.msx.om/trading-calendar",
        "status": "closed"
      },
      {
        "date": "2026-07-23",
        "name": "Renaissance Day",
        "source_url": "https://www.msx.om/trading-calendar",
        "status": "closed"
      },
      {
        "date": "2026-11-18",
        "name": "National Day",
        "source_url": "https://www.msx.om/trading-calendar",
        "status": "closed"
      },
      {
        "date": "2027-03-09",
        "name": "Eid al-Fitr (predicted)",
        "predicted": true,
        "source_url": "https://www.msx.om/trading-calendar",
        "status": "closed"
      },
      {
        "date": "2027-03-10",
        "name": "Eid al-Fitr Holiday (predicted)",
        "predicted": true,
        "source_url": "https://www.msx.om/trading-calendar",
        "status": "closed"
      },
      {
        "date": "2027-03-11",
        "name": "Eid al-Fitr Holiday (predicted)",
        "predicted": true,
        "source_url": "https://www.msx.om/trading-calendar",
        "status": "closed"
      },
      {
        "date": "2027-05-16",
        "name": "Eid al-Adha (predicted)",
        "predicted": true,
        "source_url": "https://www.msx.om/trading-calendar",
        "status": "closed"
      },
      {
        "date": "2027-05-17",
        "name": "Eid al-Adha Holiday (predicted)",
        "predicted": true,
        "source_url": "https://www.msx.om/trading-calendar",
        "status": "closed"
      },
      {
        "date": "2027-06-06",
        "name": "Islamic New Year (predicted)",
        "predicted": true,
        "source_url": "https://www.msx.om/trading-calendar",
        "status": "closed"
      },
      {
        "date": "2027-07-25",
        "name": "Renaissance Day (observed)",
        "source_url": "https://www.msx.om/trading-calendar",
        "status": "closed"
      },
      {
        "date": "2027-08-15",
        "name": "Prophet's Birthday (predicted)",
        "predicted": true,
        "source_url": "https://www.msx.om/trading-calendar",
        "status": "closed"
      },
      {
        "date": "2027-11-18",
        "name": "National Day",
        "source_url": "https://www.msx.om/trading-calendar",
        "status": "closed"
      },
      {
        "date": "2028-01-02",
        "name": "New Year's Day (observed)",
        "source_url": "https://www.msx.om/trading-calendar",
        "status": "closed"
      },
      {
        "date": "2028-02-27",
        "name": "Eid al-Fitr Holiday (predicted)",
        "predicted": true,
        "source_url": "https://www.msx.om/trading-calendar",
        "status": "closed"
      },
      {
        "date": "2028-05-04",
        "name": "Eid al-Adha (predicted)",
        "predicted": true,
        "source_url": "https://www.msx.om/trading-calendar",
        "status": "closed"
      },
      {
        "date": "2028-05-25",
        "name": "Islamic New Year (predicted)",
        "predicted": true,
        "source_url": "https://www.msx.om/trading-calendar",
        "status": "closed"
      },
      {
        "date": "2028-07-23",
        "name": "Renaissance Day",
        "source_url": "https://www.msx.om/trading-calendar",
        "status": "closed"
      },
      {
        "date": "2028-11-19",
        "name": "National Day (observed)",
        "source_url": "https://www.msx.om/trading-calendar",
        "status": "closed"
      },
      {
        "date": "2029-01-01",
        "name": "New Year's Day",
        "source_url": "https://www.msx.om/trading-calendar",
        "status": "closed"
      },
      {
        "date": "2029-02-14",
        "name": "Eid al-Fitr (predicted)",
        "predicted": true,
        "source_url": "https://www.msx.om/trading-calendar",
        "status": "closed"
      },
      {
        "date": "2029-02-15",
        "name": "Eid al-Fitr Holiday (predicted)",
        "predicted": true,
        "source_url": "https://www.msx.om/trading-calendar",
        "status": "closed"
      },
      {
        "date": "2029-04-24",
        "name": "Eid al-Adha (predicted)",
        "predicted": true,
        "source_url": "https://www.msx.om/trading-calendar",
        "status": "closed"
      },
      {
        "date": "2029-04-25",
        "name": "Eid al-Adha Holiday (predicted)",
        "predicted": true,
        "source_url": "https://www.msx.om/trading-calendar",
        "status": "closed"
      },
      {
        "date": "2029-05-14",
        "name": "Islamic New Year (predicted)",
        "predicted": true,
        "source_url": "https://www.msx.om/trading-calendar",
        "status": "closed"
      },
      {
        "date": "2029-07-23",
        "name": "Renaissance Day",
        "source_url": "https://www.msx.om/trading-calendar",
        "status": "closed"
      },
      {
        "date": "2029-07-24",
        "name": "Prophet's Birthday (predicted)",
        "predicted": true,
        "source_url": "https://www.msx.om/trading-calendar",
        "status": "closed"
      },
      {
        "date": "2029-11-18",
        "name": "National Day",
        "source_url": "https://www.msx.om/trading-calendar",
        "status": "closed"
      }
    ],
    "recurrence_rules": [
      {
        "day": 1,
        "month": 1,
        "name": "New Year's Day",
        "rule": "fixed_with_weekend_adjustment",
        "status": "closed"
      },
      {
        "day": 23,
        "month": 7,
        "name": "Renaissance Day",
        "rule": "fixed_with_weekend_adjustment",
        "status": "closed"
      },
      {
        "day": 18,
        "month": 11,
        "name": "National Day",
        "rule": "fixed_with_weekend_adjustment",
        "status": "closed"
      }
    ]
  },
  "mic": "XMUS",
  "name": "Muscat Stock Exchange",
  "regular_hours": {
    "close": "13:00",
    "open": "10:00"
  },
  "sessions": [
    {
      "close": "13:00",
      "open": "10:00",
      "type": "regular"
    }
  ],
  "timezone": "Asia/Muscat",
  "weekend_days": [
    4,
    5
  ]
}
